Unnamed: 0,movie_title,year,director,actors,war,biography,western,thriller,adventure,romance,reality-tv,mystery,horror,film-noir,musical,sport,animation,action,comedy,fantasy,history,sci-fi,music,crime,drama,family,overviews,description
1,The Dark Knight,2008,Christopher Nolan,"Christian Bale, Heath Ledger, Aaron Eckhart, Michael Caine",0,0,0,0,0,0,0,0,0,0,0,0,0,1,0,0,0,0,0,1,1,0,"Batman raises the stakes in his war on crime. With the help of Lt. Jim Gordon and District Attorney Harvey Dent, Batman sets out to dismantle the remaining criminal organizations that plague the streets. The partnership proves to be effective, but they soon find themselves prey to a reign of chaos unleashed by a rising criminal mastermind known to the terrified citizens of Gotham as the Joker.","['Joker', 'Jim Gordon', 'Batman', 'Gotham', 'Harvey Dent']"
2,The Lord of the Rings: The Return of the King,2003,Peter Jackson,"Elijah Wood, Viggo Mortensen, Ian McKellen, Orlando Bloom",0,0,0,0,1,0,0,0,0,0,0,0,0,1,0,0,0,0,0,0,1,0,"Aragorn is revealed as the heir to the ancient kings as he, Gandalf and the other members of the broken fellowship struggle to save Gondor from Sauron's forces. Meanwhile, Frodo and Sam take the ring closer to the heart of Mordor, the dark lord's realm.","['Frodo', 'Aragorn', 'Sam', 'Gandalf', 'Gondor', 'Sauron', 'Mordor']"
3,Inception,2010,Christopher Nolan,"Leonardo DiCaprio, Joseph Gordon-Levitt, Elliot Page, Ken Watanabe",0,0,0,0,1,0,0,0,0,0,0,0,0,1,0,0,0,1,0,0,0,0,"Cobb, a skilled thief who commits corporate espionage by infiltrating the subconscious of his targets is offered a chance to regain his old life as payment for a task considered to be impossible: ""inception"", the implantation of another person's idea into a target's subconscious.",['Cobb']
4,The Lord of the Rings: The Two Towers,2002,Peter Jackson,"Elijah Wood, Ian McKellen, Viggo Mortensen, Orlando Bloom",0,0,0,0,1,0,0,0,0,0,0,0,0,1,0,0,0,0,0,0,1,0,"Frodo and Sam are trekking to Mordor to destroy the One Ring of Power while Gimli, Legolas and Aragorn search for the orc-captured Merry and Pippin. All along, nefarious wizard Saruman awaits the Fellowship members at the Orthanc Tower in Isengard.","['Isengard', 'Frodo', 'Aragorn', 'Fellowship', 'the Orthanc Tower', 'Saruman', 'Sam', 'Pippin', 'Merry', 'Gimli', 'Mordor', 'the One Ring of Power', 'Legolas']"
5,The Lord of the Rings: The Fellowship of the Ring,2001,Peter Jackson,"Elijah Wood, Ian McKellen, Orlando Bloom, Sean Bean",0,0,0,0,1,0,0,0,0,0,0,0,0,1,0,0,0,0,0,0,1,0,"Young hobbit Frodo Baggins, after inheriting a mysterious ring from his uncle Bilbo, must leave his home in order to keep it from falling into the hands of its evil creator. Along the way, a fellowship is formed to protect the ringbearer and make sure that the ring arrives at its final destination: Mt. Doom, the only place where it can be destroyed.","['Young hobbit Frodo Baggins', 'Bilbo']"
6,The Matrix,1999,"Directors:Lana Wachowski, Lilly Wachowski","Keanu Reeves, Laurence Fishburne, Carrie-Anne Moss, Hugo Weaving",0,0,0,0,0,0,0,0,0,0,0,0,0,1,0,0,0,1,0,0,0,0,"Set in the 22nd century, The Matrix tells the story of a computer hacker who joins a group of underground insurgents fighting the vast and powerful computers who now rule the earth.","['The Matrix', 'the 22nd century']"
8,Terminator 2: Judgment Day,1991,James Cameron,"Arnold Schwarzenegger, Linda Hamilton, Edward Furlong, Robert Patrick",0,0,0,0,0,0,0,0,0,0,0,0,0,1,0,0,0,1,0,0,0,0,"Nearly 10 years have passed since Sarah Connor was targeted for termination by a cyborg from the future. Now her son, John, the future leader of the resistance, is the target for a newer, more deadly terminator. Once again, the resistance has managed to send a protector back to attempt to save John and his mother Sarah.","['Nearly 10 years', 'Sarah Connor', 'Sarah', 'John']"
15,Gladiator,2000,Ridley Scott,"Russell Crowe, Joaquin Phoenix, Connie Nielsen, Oliver Reed",0,0,0,0,1,0,0,0,0,0,0,0,0,1,0,0,0,0,0,0,1,0,"In the year 180, the death of emperor Marcus Aurelius throws the Roman Empire into chaos.  Maximus is one of the Roman army's most capable and trusted generals and a key advisor to the emperor.  As Marcus' devious son Commodus ascends to the throne, Maximus is set to be executed.  He escapes, but is captured by slave traders.  Renamed Spaniard and forced to become a gladiator, Maximus must battle to the death with other men for the amusement of paying audiences.","['Maximus', 'one', 'Commodus', 'Marcus Aurelius', 'the Roman Empire', 'Roman', 'Marcus', 'Spaniard', 'the year 180']"
18,Spider-Man: Into the Spider-Verse,2018,"Directors:Bob Persichetti, Peter Ramsey, Rodney Rothman","Shameik Moore, Jake Johnson, Hailee Steinfeld, Mahershala Ali",0,0,0,0,1,0,0,0,0,0,0,0,1,1,0,0,0,0,0,0,0,0,"Miles Morales is juggling his life between being a high school student and being a spider-man. When Wilson ""Kingpin"" Fisk uses a super collider, others from across the Spider-Verse are transported to this dimension.","['the Spider-Verse', 'Fisk', 'Miles Morales', 'Wilson']"
19,Avengers: Endgame,2019,"Directors:Anthony Russo, Joe Russo","Robert Downey Jr., Chris Evans, Mark Ruffalo, Chris Hemsworth",0,0,0,0,1,0,0,0,0,0,0,0,0,1,0,0,0,0,0,0,1,0,"After the devastating events of Avengers: Infinity War, the universe is in ruins due to the efforts of the Mad Titan, Thanos. With the help of remaining allies, the Avengers must assemble once more in order to undo Thanos' actions and restore order to the universe once and for all, no matter what consequences may be in store.","['Thanos', 'Avengers: Infinity War', 'the Mad Titan', 'Avengers']"
20,Avengers: Infinity War,2018,"Directors:Anthony Russo, Joe Russo","Robert Downey Jr., Chris Hemsworth, Mark Ruffalo, Chris Evans",0,0,0,0,1,0,0,0,0,0,0,0,0,1,0,0,0,1,0,0,0,0,"As the Avengers and their allies have continued to protect the world from threats too large for any one hero to handle, a new danger has emerged from the cosmic shadows: Thanos. A despot of intergalactic infamy, his goal is to collect all six Infinity Stones, artifacts of unimaginable power, and use them to inflict his twisted will on all of reality. Everything the Avengers have fought for has led up to this moment - the fate of Earth and existence itself has never been more uncertain.","['six', 'one', 'Earth', 'Thanos', 'Infinity Stones', 'Avengers']"
22,The Dark Knight Rises,2012,Christopher Nolan,"Christian Bale, Tom Hardy, Anne Hathaway, Gary Oldman",0,0,0,0,0,0,0,0,0,0,0,0,0,1,0,0,0,0,0,0,1,0,"Following the death of District Attorney Harvey Dent, Batman assumes responsibility for Dent's crimes to protect the late attorney's reputation and is subsequently hunted by the Gotham City Police Department. Eight years later, Batman encounters the mysterious Selina Kyle and the villainous Bane, a new terrorist leader who overwhelms Gotham's finest. The Dark Knight resurfaces to protect a city that has branded him an enemy.","['Batman', 'the Gotham City Police Department', 'Gotham', 'Bane', 'The Dark Knight', 'Eight years later', 'Dent', 'Selina Kyle', 'Harvey Dent']"
27,Aliens,1986,James Cameron,"Sigourney Weaver, Michael Biehn, Carrie Henn, Paul Reiser",0,0,0,0,1,0,0,0,0,0,0,0,0,1,0,0,0,1,0,0,0,0,"When Ripley's lifepod is found by a salvage crew over 50 years later, she finds that terra-formers are on the very planet they found the alien species. When the company sends a family of colonists out to investigate her story¡ªall contact is lost with the planet and colonists. They enlist Ripley and the colonial marines to return and search for answers.","['Ripley', '50 years later']"
29,Vikram Vedha,2017,"Directors:Gayatri, Pushkar, Gowtham Selvaraj","Madhavan, Vijay Sethupathi, Shraddha Srinath, Kathir",0,0,0,0,0,0,0,0,0,0,0,0,0,1,0,0,0,0,0,1,1,0,A notorious gangster Vedha surrenders himself to encounter specialist Vikram whom he challenges every step of the way by narrating his life events in the form of riddles that needs to be solved in order to capture him.,"['Vikram', 'Vedha']"
30,Dangal,2016,Nitesh Tiwari,"Aamir Khan, Sakshi Tanwar, Fatima Sana Shaikh, Sanya Malhotra",0,1,0,0,0,0,0,0,0,0,0,0,0,1,0,0,0,0,0,0,1,0,"Dangal is an extraordinary true story based on the life of Mahavir Singh and his two daughters, Geeta and Babita Phogat. The film traces the inspirational journey of a father who trains his daughters to become world class wrestlers.","['two', 'Geeta', 'Babita Phogat', 'Dangal', 'Mahavir Singh']"
31,Spider-Man: No Way Home,2021,Jon Watts,"Tom Holland, Zendaya, Benedict Cumberbatch, Jacob Batalon",0,0,0,0,1,0,0,0,0,0,0,0,0,1,0,1,0,0,0,0,0,0,"Peter Parker is unmasked and no longer able to separate his normal life from the high-stakes of being a super-hero. When he asks for help from Doctor Strange the stakes become even more dangerous, forcing him to discover what it truly means to be Spider-Man.","['Spider-Man', 'Peter Parker', 'Doctor Strange']"
32,Heat,1995,Michael Mann,"Al Pacino, Robert De Niro, Val Kilmer, Jon Voight",0,0,0,0,0,0,0,0,0,0,0,0,0,1,0,0,0,0,0,1,1,0,Obsessive master thief Neil McCauley leads a top-notch crew on various daring heists throughout Los Angeles while determined detective Vincent Hanna pursues him without rest. Each man recognizes and respects the ability and the dedication of the other even though they are aware their cat-and-mouse game may end in violence.,"['Los Angeles', 'Vincent Hanna', 'Neil McCauley']"
33,Star Wars: Episode VI - Return of the Jedi,1983,Richard Marquand,"Mark Hamill, Harrison Ford, Carrie Fisher, Billy Dee Williams",0,0,0,0,1,0,0,0,0,0,0,0,0,1,0,1,0,0,0,0,0,0,"Luke Skywalker leads a mission to rescue his friend Han Solo from the clutches of Jabba the Hutt, while the Emperor seeks to destroy the Rebellion once and for all with a second dreaded Death Star.","['Han Solo', 'Luke Skywalker', 'Jabba the Hutt', 'second', 'Death Star']"
34,North by Northwest,1959,Alfred Hitchcock,"Cary Grant, Eva Marie Saint, James Mason, Jessie Royce Landis",0,0,0,0,1,0,0,1,0,0,0,0,0,1,0,0,0,0,0,0,0,0,"Advertising man Roger Thornhill is mistaken for a spy, triggering a deadly cross-country chase.",['Roger Thornhill']
36,1917,2019,Sam Mendes,"Dean-Charles Chapman, George MacKay, Daniel Mays, Colin Firth",1,0,0,0,0,0,0,0,0,0,0,0,0,1,0,0,0,0,0,0,1,0,"At the height of the First World War, two young British soldiers must cross enemy territory and deliver a message that will stop a deadly attack on hundreds of soldiers.","['two', 'the First World War', 'British', 'hundreds']"
41,Gangs of Wasseypur,2012,Anurag Kashyap,"Manoj Bajpayee, Ashish Chhipa, Richa Chadha, Nawazuddin Siddiqui",0,0,0,0,0,0,0,0,0,0,0,0,0,1,1,0,0,0,0,1,0,0,"Shahid Khan is exiled after impersonating the legendary Sultana Daku in order to rob British trains. Now outcast, Shahid becomes a worker at Ramadhir Singh's colliery, only to spur a revenge battle that passes on to generations. At the turn of the decade, Shahid's son, the philandering Sardar Khan vows to get his father's honor back, becoming the most feared man of Wasseypur.","['Sultana Daku', 'the turn of the decade', 'British', 'Shahid', 'Wasseypur', 'Shahid Khan', 'Sardar Khan', ""Ramadhir Singh's""]"
43,Warrior,2011,Gavin O'Connor,"Tom Hardy, Nick Nolte, Joel Edgerton, Jennifer Morrison",0,0,0,0,0,0,0,0,0,0,0,1,0,1,0,0,0,0,0,0,1,0,"The youngest son of an alcoholic former boxer returns home, where he's trained by his father for competition in a mixed martial arts tournament ¨C a path that puts the fighter on a collision course with his estranged, older brother.",[]
45,V for Vendetta,2005,James McTeigue,"Hugo Weaving, Natalie Portman, Rupert Graves, Stephen Rea",0,0,0,0,0,0,0,0,0,0,0,0,0,1,0,0,0,1,0,0,1,0,,
46,Batman Begins,2005,Christopher Nolan,"Christian Bale, Michael Caine, Ken Watanabe, Liam Neeson",0,0,0,0,0,0,0,0,0,0,0,0,0,1,0,0,0,0,0,1,1,0,"Driven by tragedy, billionaire Bruce Wayne dedicates his life to uncovering and defeating the corruption that plagues his home, Gotham City.  Unable to work within the system, he instead creates a new identity, a symbol of fear for the criminal underworld - The Batman.","['Bruce Wayne', 'Batman', 'Gotham City']"
47,Kill Bill: Vol. 1,2003,Quentin Tarantino,"Uma Thurman, David Carradine, Daryl Hannah, Michael Madsen",0,0,0,0,0,0,0,0,0,0,0,0,0,1,0,0,0,0,0,1,1,0,"An assassin is shot by her ruthless employer, Bill, and other members of their assassination circle ¨C but she lives to plot her vengeance.",['Bill']
48,"Lock, Stock and Two Smoking Barrels",1998,Guy Ritchie,"Jason Flemyng, Dexter Fletcher, Nick Moran, Jason Statham",0,0,0,0,0,0,0,0,0,0,0,0,0,1,1,0,0,0,0,1,0,0,A card shark and his unwillingly-enlisted friends need to make a lot of cash quick after losing a sketchy poker match. To do this they decide to pull a heist on a small-time gang who happen to be operating out of the flat next door.,[]
49,Jurassic Park,1993,Steven Spielberg,"Sam Neill, Laura Dern, Jeff Goldblum, Richard Attenborough",0,0,0,0,1,0,0,0,0,0,0,0,0,1,0,0,0,1,0,0,0,0,"A wealthy entrepreneur secretly creates a theme park featuring living dinosaurs drawn from prehistoric DNA. Before opening day, he invites a team of experts and his two eager grandchildren to experience the park and help calm anxious investors. However, the park is anything but amusing as the security systems go off-line and the dinosaurs escape.","['two', 'opening day']"
50,Indiana Jones and the Last Crusade,1989,Steven Spielberg,"Harrison Ford, Sean Connery, Alison Doody, Denholm Elliott",0,0,0,0,1,0,0,0,0,0,0,0,0,1,0,0,0,0,0,0,0,0,"When Dr. Henry Jones Sr. suddenly goes missing while pursuing the Holy Grail, eminent archaeologist Indiana must team up with Marcus Brody, Sallah and Elsa Schneider to follow in his father's footsteps and stop the Nazis from recovering the power of eternal life.","['Henry Jones Sr.', 'Sallah', 'Indiana', 'the Holy Grail', 'Nazis', 'Elsa Schneider', 'Marcus Brody']"
51,Die Hard,1988,John McTiernan,"Bruce Willis, Alan Rickman, Bonnie Bedelia, Reginald VelJohnson",0,0,0,1,0,0,0,0,0,0,0,0,0,1,0,0,0,0,0,0,0,0,"NYPD cop John McClane's plan to reconcile with his estranged wife is thrown for a serious loop when, minutes after he arrives at her office, the entire building is overtaken by a group of terrorists. With little help from the LAPD, wisecracking McClane sets out to single-handedly rescue the hostages and bring the bad guys down.","['minutes', ""John McClane's"", 'LAPD', 'McClane', 'NYPD']"
52,Ran,1985,Akira Kurosawa,"Tatsuya Nakadai, Akira Terao, Jinpachi Nezu, Daisuke Ry?",1,0,0,0,0,0,0,0,0,0,0,0,0,1,0,0,0,0,0,0,1,0,"With Ran, legendary director Akira Kurosawa reimagines Shakespeare's King Lear as a singular historical epic set in sixteenth-century Japan. Majestic in scope, the film is Kurosawa's late-life masterpiece, a profound examination of the folly of war and the crumbling of one family under the weight of betrayal, greed, and the insatiable thirst for power.","['Japan', 'Kurosawa', 'one', 'Shakespeare', 'Akira Kurosawa', 'King Lear', 'Ran', 'sixteenth-century']"
54,The General,1926,"Directors:Clyde Bruckman, Buster Keaton","Buster Keaton, Marion Mack, Glen Cavender, Jim Farley",0,0,0,0,1,0,0,0,0,0,0,0,0,1,1,0,0,0,0,0,0,0,"During America¡¯s Civil War, Union spies steal engineer Johnnie Gray's beloved locomotive, 'The General'¡ªwith Johnnie's lady love aboard an attached boxcar¡ªand he single-handedly must do all in his power to both get The General back and to rescue Annabelle.","['America', 'Annabelle', 'Union', 'Civil War', 'Johnnie Gray', 'Johnnie']"
55,Sherlock Jr.,1924,Buster Keaton,"Buster Keaton, Kathryn McGuire, Joe Keaton, Erwin Connelly",0,0,0,0,0,1,0,0,0,0,0,0,0,1,1,0,0,0,0,0,0,0,"A film projectionist longs to be a detective, and puts his meagre skills to work when he is framed by a rival for stealing his girlfriend's father's pocketwatch.",[]
58,Logan,2017,James Mangold,"Hugh Jackman, Patrick Stewart, Dafne Keen, Boyd Holbrook",0,0,0,0,0,0,0,0,0,0,0,0,0,1,0,0,0,1,0,0,1,0,"In the near future, a weary Logan cares for an ailing Professor X in a hideout on the Mexican border. But Logan's attempts to hide from the world and his legacy are upended when a young mutant arrives, pursued by dark forces.","['Professor X', 'Logan', 'Mexican']"
59,Rush,2013,Ron Howard,"Daniel Br¨¹hl, Chris Hemsworth, Olivia Wilde, Alexandra Maria Lara",0,1,0,0,0,0,0,0,0,0,0,0,0,1,0,0,0,0,0,0,1,0,A biographical drama centered on the rivalry between Formula 1 drivers James Hunt and Niki Lauda during the 1976 Formula One motor-racing season.,"['1976', 'Formula One motor-racing season', 'Niki Lauda', 'Formula 1', 'James Hunt']"
60,Ford v Ferrari,2019,James Mangold,"Matt Damon, Christian Bale, Jon Bernthal, Caitr¨ªona Balfe",0,1,0,0,0,0,0,0,0,0,0,0,0,1,0,0,0,0,0,0,1,0,"American car designer Carroll Shelby and the British-born driver Ken Miles work together to battle corporate interference, the laws of physics, and their own personal demons to build a revolutionary race car for Ford Motor Company and take on the dominating race cars of Enzo Ferrari at the 24 Hours of Le Mans in France in 1966.","['Ford Motor Company', 'British', 'the 24 Hours of Le Mans', 'France', '1966', 'Ken Miles', 'Carroll Shelby', 'American', 'Enzo Ferrari']"
61,Mad Max: Fury Road,2015,George Miller,"Tom Hardy, Charlize Theron, Nicholas Hoult, Zo? Kravitz",0,0,0,0,1,0,0,0,0,0,0,0,0,1,0,0,0,1,0,0,0,0,"An apocalyptic story set in the furthest reaches of our planet, in a stark desert landscape where humanity is broken, and most everyone is crazed fighting for the necessities of life. Within this world exist two rebels on the run who just might be able to restore order.",['two']
62,A Wednesday,2008,Neeraj Pandey,"Anupam Kher, Naseeruddin Shah, Veerendra Saxena, Mahesh Kanual",0,0,0,0,0,0,0,0,0,0,0,0,0,1,0,0,0,0,0,1,1,0,"A retired police commissioner recounts the most memorable case of his career, wherein he was informed about a bomb scare in Mumbai.",['Mumbai']
63,How to Train Your Dragon,2010,"Directors:Dean DeBlois, Chris Sanders","Jay Baruchel, Gerard Butler, Christopher Mintz-Plasse, Craig Ferguson",0,0,0,0,1,0,0,0,0,0,0,0,1,1,0,0,0,0,0,0,0,0,"As the son of a Viking leader on the cusp of manhood, shy Hiccup Horrendous Haddock III faces a rite of passage: he must kill a dragon to prove his warrior mettle. But after downing a feared dragon, he realizes that he no longer wants to destroy it, and instead befriends the beast ¨C which he names Toothless ¨C much to the chagrin of his warrior father.","['Viking', 'Toothless', 'Hiccup Horrendous Haddock III']"
64,Pirates of the Caribbean: The Curse of the Black Pearl,2003,Gore Verbinski,"Johnny Depp, Geoffrey Rush, Orlando Bloom, Keira Knightley",0,0,0,0,1,0,0,0,0,0,0,0,0,1,0,1,0,0,0,0,0,0,"Jack Sparrow, a freewheeling 18th-century pirate, quarrels with a rival pirate bent on pillaging Port Royal. When the governor's daughter is kidnapped, Sparrow decides to help the girl's love save her.","['Jack Sparrow', '18th-century', 'Sparrow', 'Port Royal']"
65,Hera Pheri,2000,Priyadarshan,"Akshay Kumar, Suniel Shetty, Paresh Rawal, Tabu",0,0,0,0,0,0,0,0,0,0,0,0,0,1,1,0,0,0,0,1,0,0,"Three unemployed men find the answer to all their money problems when they receive a call from a kidnapper. However, things do not go as planned.",['Three']
67,The Iron Giant,1999,Brad Bird,"Eli Marienthal, Harry Connick Jr., Jennifer Aniston, Vin Diesel",0,0,0,0,1,0,0,0,0,0,0,0,1,1,0,0,0,0,0,0,0,0,"In the small town of Rockwell, Maine in October 1957, a giant metal machine befriends a nine-year-old boy and ultimately finds its humanity by unselfishly saving people from their own fears and prejudices.","['nine-year-old', 'Maine', 'October 1957', 'Rockwell']"
68,The Terminator,1984,James Cameron,"Arnold Schwarzenegger, Linda Hamilton, Michael Biehn, Paul Winfield",0,0,0,0,0,0,0,0,0,0,0,0,0,1,0,0,0,1,0,0,0,0,"In the post-apocalyptic future, reigning tyrannical supercomputers teleport a cyborg assassin known as the ""Terminator"" back to 1984 to kill Sarah Connor, whose unborn son is destined to lead insurgents against 21st century mechanical hegemony. Meanwhile, the human-resistance movement dispatches a lone warrior to safeguard Sarah. Can he stop the virtually indestructible killing machine?","['Sarah Connor', 'Terminator', '21st century', '1984', 'Sarah']"
69,Blade Runner,1982,Ridley Scott,"Harrison Ford, Rutger Hauer, Sean Young, Edward James Olmos",0,0,0,0,0,0,0,0,0,0,0,0,0,1,0,0,0,1,0,0,1,0,"In the smog-choked dystopian Los Angeles of 2019, blade runner Rick Deckard is called out of retirement to terminate a quartet of replicants who have escaped to Earth seeking their creator for a way to extend their short life spans.","['Rick Deckard', 'Los Angeles', '2019', 'Earth']"
70,Sholay,1975,Ramesh Sippy,"Sanjeev Kumar, Dharmendra, Amitabh Bachchan, Amjad Khan",0,0,0,0,1,0,0,0,0,0,0,0,0,1,1,0,0,0,0,0,0,0,"After his family is murdered by a notorious and ruthless bandit, a former police officer enlists the services of two outlaws to capture the bandit.",['two']
72,White Heat,1949,Raoul Walsh,"James Cagney, Virginia Mayo, Edmond O'Brien, Margaret Wycherly",0,0,0,0,0,0,0,0,0,0,0,0,0,1,0,0,0,0,0,1,1,0,"A psychopathic criminal with a mother complex makes a daring break from prison and then leads his old gang in a chemical plant payroll heist. After the heist, events take a crazy turn.",[]
80,Guardians of the Galaxy,2014,James Gunn,"Chris Pratt, Vin Diesel, Bradley Cooper, Zoe Saldana",0,0,0,0,1,0,0,0,0,0,0,0,0,1,1,0,0,0,0,0,0,0,"Light years from Earth, 26 years after being abducted, Peter Quill finds himself the prime target of a manhunt after discovering an orb wanted by Ronan the Accuser.","['Peter Quill', 'Ronan the Accuser', 'Earth', '26 years']"
81,Blade Runner 2049,2017,Denis Villeneuve,"Harrison Ford, Ryan Gosling, Ana de Armas, Dave Bautista",0,0,0,0,0,0,0,1,0,0,0,0,0,1,0,0,0,0,0,0,1,0,"Thirty years after the events of the first film, a new blade runner, LAPD Officer K, unearths a long-buried secret that has the potential to plunge what's left of society into chaos. K's discovery leads him on a quest to find Rick Deckard, a former LAPD blade runner who has been missing for 30 years.","['30 years', 'Rick Deckard', 'LAPD', 'Thirty years', 'first', ""K's""]"
87,Ip Man,2008,Wilson Yip,"Donnie Yen, Simon Yam, Siu-Wong Fan, Ka-Tung Lam",0,1,0,0,0,0,0,0,0,0,0,0,0,1,0,0,0,0,0,0,1,0,"A semi-biographical account of Yip Man, the first martial arts master to teach the Chinese martial art of Wing Chun. The film focuses on events surrounding Ip that took place in the city of Foshan between the 1930s to 1940s during the Second Sino-Japanese War. Directed by Wilson Yip, the film stars Donnie Yen in the lead role, and features fight choreography by Sammo Hung.","['Wilson Yip', 'Chinese', 'the Second Sino-Japanese War', 'Yip Man', 'Wing Chun', 'the 1930s to 1940s', 'Sammo Hung', 'Donnie Yen', 'Foshan', 'first']"
91,The Avengers,2012,Joss Whedon,"Robert Downey Jr., Chris Evans, Scarlett Johansson, Jeremy Renner",0,0,0,0,1,0,0,0,0,0,0,0,0,1,0,0,0,1,0,0,0,0,"When an unexpected enemy emerges and threatens global safety and security, Nick Fury, director of the international peacekeeping agency known as S.H.I.E.L.D., finds himself in need of a team to pull the world back from the brink of disaster. Spanning the globe, a daring recruitment effort begins!","['S.H.I.E.L.D.', 'Nick Fury']"
92,The Bourne Ultimatum,2007,Paul Greengrass,"Matt Damon, Edgar Ram¨ªrez, Joan Allen, Julia Stiles",0,0,0,1,0,0,0,1,0,0,0,0,0,1,0,0,0,0,0,0,0,0,"Bourne is brought out of hiding once again by reporter Simon Ross who is trying to unveil Operation Blackbriar, an upgrade to Project Treadstone, in a series of newspaper columns. Information from the reporter stirs a new set of memories, and Bourne must finally uncover his dark past while dodging The Company's best efforts to eradicate him.","['Project Treadstone', 'Simon Ross', 'Operation Blackbriar', 'Company', 'Bourne']"
94,Casino Royale,2006,Martin Campbell,"Daniel Craig, Eva Green, Judi Dench, Jeffrey Wright",0,0,0,1,1,0,0,0,0,0,0,0,0,1,0,0,0,0,0,0,0,0,"Le Chiffre, a banker to the world's terrorists, is scheduled to participate in a high-stakes poker game in Montenegro, where he intends to use his winnings to establish his financial grip on the terrorist market. M sends Bond¡ªon his maiden mission as a 00 Agent¡ªto attend this game and prevent Le Chiffre from winning. With the help of Vesper Lynd and Felix Leiter, Bond enters the most important poker game in his already dangerous career.","['Bond', 'a 00 Agent', 'Le Chiffre', 'Felix Leiter', 'Montenegro', 'Vesper Lynd']"
95,Kill Bill: Vol. 2,2004,Quentin Tarantino,"Uma Thurman, David Carradine, Michael Madsen, Daryl Hannah",0,0,0,1,0,0,0,0,0,0,0,0,0,1,0,0,0,0,0,1,0,0,"The Bride unwaveringly continues on her roaring rampage of revenge against the band of assassins who had tried to kill her and her unborn child. She visits each of her former associates one-by-one, checking off the victims on her Death List Five until there's nothing left to do ¡­ but kill Bill.","['Death List Five', 'Bride', 'Bill']"
97,The Incredibles,2004,Brad Bird,"Craig T. Nelson, Samuel L. Jackson, Holly Hunter, Jason Lee",0,0,0,0,1,0,0,0,0,0,0,0,1,1,0,0,0,0,0,0,0,0,"Bob Parr has given up his superhero days to log in time as an insurance adjuster and raise his three children with his formerly heroic wife in suburbia. But when he receives a mysterious assignment, it's time to get back into costume.","['three', 'Bob Parr']"
99,Andaz Apna Apna,1994,Rajkumar Santoshi,"Aamir Khan, Salman Khan, Raveena Tandon, Karisma Kapoor",0,0,0,0,0,1,0,0,0,0,0,0,0,1,1,0,0,0,0,0,0,0,Two slackers competing for the affections of an heiress inadvertently become her protectors from an evil criminal.,['Two']
