Unnamed: 0,movie_title,year,director,actors,war,biography,western,thriller,adventure,romance,reality-tv,mystery,horror,film-noir,musical,sport,animation,action,comedy,fantasy,history,sci-fi,music,crime,drama,family,overviews,description
2291,Out of the Past,1947,Jacques Tourneur,"Robert Mitchum, Jane Greer, Kirk Douglas, Rhonda Fleming",0,0,0,0,0,0,0,0,0,1,0,0,0,0,0,0,0,0,0,1,1,0,"Jeff Bailey seems to be a mundane gas station owner in remote Bridgeport, CA. He is dating local girl Ann Miller and lives a quiet life. But Jeff has a secret past, and when a mysterious stranger arrives in town, Jeff is forced to return to the dark world he had tried to escape.","['Bridgeport', 'Jeff Bailey', 'Ann Miller', 'Jeff', 'CA']"
2292,The Maltese Falcon,1941,John Huston,"Humphrey Bogart, Mary Astor, Gladys George, Peter Lorre",0,0,0,0,0,0,0,1,0,1,0,0,0,0,0,0,0,0,0,1,0,0,"A private detective takes on a case that involves him with three eccentric criminals, a beautiful liar, and their quest for a priceless statuette.",['three']
2295,In Bruges,2008,Martin McDonagh,"Colin Farrell, Brendan Gleeson, Ciar¨¢n Hinds, Elizabeth Berrington",0,0,0,0,0,0,0,0,0,0,0,0,0,0,1,0,0,0,0,1,1,0,"Ray and Ken, two hit men, are in Bruges, Belgium, waiting for their next mission. While they are there they have time to think and discuss their previous assignment. When the mission is revealed to Ken, it is not what he expected.","['Ken', 'two', 'Bruges', 'Belgium', 'Ray']"
2297,Mystic River,2003,Clint Eastwood,"Sean Penn, Tim Robbins, Kevin Bacon, Emmy Rossum",0,0,0,0,0,0,0,1,0,0,0,0,0,0,0,0,0,0,0,1,1,0,The lives of three men who were childhood friends are shattered when one of them has a family tragedy.,"['three', 'one']"
2299,Dancer in the Dark,2000,Lars von Trier,"Bj?rk, Catherine Deneuve, David Morse, Peter Stormare",0,0,0,0,0,0,0,0,0,0,1,0,0,0,0,0,0,0,0,1,1,0,"Selma, a Czech immigrant on the verge of blindness, struggles to make ends meet for herself and her son, who has inherited the same genetic disorder and will suffer the same fate without an expensive operation. When life gets too difficult, Selma learns to cope through her love of musicals, escaping life's troubles - even if just for a moment - by dreaming up little numbers to the rhythmic beats of her surroundings.","['Czech', 'Selma']"
2300,Once Were Warriors,1994,Lee Tamahori,"Rena Owen, Temuera Morrison, Mamaengaroa Kerr-Bell, Julian Arahanga",0,0,0,0,0,0,0,0,0,0,0,0,0,0,0,0,0,0,0,1,1,0,"A drama about a Maori family living in Auckland, New Zealand. Lee Tamahori tells the story of Beth Heke¡¯s strong will to keep her family together during times of unemployment and abuse from her violent and alcoholic husband.","['New Zealand', 'Beth Heke', 'Lee Tamahori', 'Auckland', 'Maori']"
2301,True Romance,1993,Tony Scott,"Christian Slater, Patricia Arquette, Dennis Hopper, Val Kilmer",0,0,0,0,0,1,0,0,0,0,0,0,0,0,0,0,0,0,0,1,1,0,"Clarence marries hooker Alabama, steals cocaine from her pimp, and tries to sell it in Hollywood, while the owners of the coke try to reclaim it.","['Hollywood', 'Alabama', 'Clarence']"
2304,The Untouchables,1987,Brian De Palma,"Kevin Costner, Sean Connery, Robert De Niro, Charles Martin Smith",0,0,0,1,0,0,0,0,0,0,0,0,0,0,0,0,0,0,0,1,1,0,"Young Treasury Agent Eliot Ness arrives in Chicago and is determined to take down Al Capone, but it's not going to be easy because Capone has the police in his pocket. Ness meets Jimmy Malone, a veteran patrolman and probably the most honorable one on the force. He asks Malone to help him get Capone, but Malone warns him that if he goes after Capone, he is going to war.","['Al Capone', 'Capone', 'Jimmy Malone', 'Treasury', 'Ness', 'Chicago', 'Eliot Ness', 'Malone']"
2308,Strangers on a Train,1951,Alfred Hitchcock,"Farley Granger, Robert Walker, Ruth Roman, Leo G. Carroll",0,0,0,0,0,0,0,0,0,1,0,0,0,0,0,0,0,0,0,1,1,0,"A deranged socialite accosts a tennis star with his theory that if two strangers trade murders, they can disguise their motives and avoid suspicion.",['two']
2309,Rope,1948,Alfred Hitchcock,"James Stewart, John Dall, Farley Granger, Dick Hogan",0,0,0,0,0,0,0,1,0,0,0,0,0,0,0,0,0,0,0,1,1,0,Two men attempt to prove they committed the perfect crime by hosting a dinner party after strangling their former classmate to death.,['Two']
2310,The Big Sleep,1946,Howard Hawks,"Humphrey Bogart, Lauren Bacall, John Ridgely, Martha Vickers",0,0,0,0,0,0,0,1,0,1,0,0,0,0,0,0,0,0,0,1,0,0,"Private Investigator Philip Marlowe is hired by wealthy General Sternwood regarding a matter involving his youngest daughter Carmen. Before the complex case is over, Marlowe sees murder, blackmail, deception, and what might be love.","['Sternwood', 'Carmen', 'Philip Marlowe', 'Marlowe']"
2312,Arsenic and Old Lace,1944,Frank Capra,"Cary Grant, Priscilla Lane, Raymond Massey, Jack Carson",0,0,0,1,0,0,0,0,0,0,0,0,0,0,1,0,0,0,0,1,0,0,"Mortimer Brewster, a newspaper drama critic, playwright, and author known for his diatribes against marriage, suddenly falls in love and gets married;  but when he makes a quick trip home to tell his two maiden aunts, he finds out his aunts' hobby - killing lonely old men and burying them in the cellar!","['Mortimer Brewster', 'two']"
2321,Crash,2004,Paul Haggis,"Don Cheadle, Sandra Bullock, Thandiwe Newton, Karina Arroyave",0,0,0,1,0,0,0,0,0,0,0,0,0,0,0,0,0,0,0,1,1,0,,
2324,Boyz n the Hood,1991,John Singleton,"Cuba Gooding Jr., Laurence Fishburne, Hudhail Al-Amir, Lloyd Avery II",0,0,0,0,0,0,0,0,0,0,0,0,0,0,0,0,0,0,0,1,1,0,Boyz n the Hood is the popular and successful film and social criticism from John Singleton about the conditions in South Central Los Angeles where teenagers are involved in gun fights and drug dealing on a daily basis.,"['Boyz n the Hood', 'Los Angeles', 'South Central', 'John Singleton']"
2334,Road to Perdition,2002,Sam Mendes,"Tom Hanks, Tyler Hoechlin, Rob Maxey, Liam Aiken",0,0,0,1,0,0,0,0,0,0,0,0,0,0,0,0,0,0,0,1,1,0,"Mike Sullivan works as a hit man for crime boss John Rooney. Sullivan views Rooney as a father figure, however after his son is witness to a killing, Mike Sullivan finds himself on the run in attempt to save the life of his son and at the same time looking for revenge on those who wronged him.","['Mike Sullivan', 'Sullivan', 'Rooney', 'John Rooney']"
2336,"O Brother, Where Art Thou?",2000,"Directors:Joel Coen, Ethan Coen","George Clooney, John Turturro, Tim Blake Nelson, John Goodman",0,0,0,0,1,0,0,0,0,0,0,0,0,0,1,0,0,0,0,1,0,0,"In the deep south during the 1930s, three escaped convicts search for hidden treasure while a relentless lawman pursues them. On their journey they come across many comical characters and incredible situations. Based upon Homer's 'Odyssey'.","['Odyssey', 'three', 'the 1930s', 'Homer']"
2340,Miller's Crossing,1990,"Directors:Joel Coen, Ethan Coen","Gabriel Byrne, Albert Finney, John Turturro, Marcia Gay Harden",0,0,0,1,0,0,0,0,0,0,0,0,0,0,0,0,0,0,0,1,1,0,"Set in 1929, a political boss and his advisor have a parting of the ways when they both fall for the same woman.",['1929']
2341,Down by Law,1986,Jim Jarmusch,"Tom Waits, John Lurie, Roberto Benigni, Nicoletta Braschi",0,0,0,0,0,0,0,0,0,0,0,0,0,0,1,0,0,0,0,1,1,0,"A disc jockey, a pimp and an Italian tourist escape from jail in New Orleans.","['New Orleans', 'Italian']"
2342,Blue Velvet,1986,David Lynch,"Isabella Rossellini, Kyle MacLachlan, Dennis Hopper, Laura Dern",0,0,0,0,0,0,0,1,0,0,0,0,0,0,0,0,0,0,0,1,1,0,"The discovery of a severed human ear found in a field leads a young man on an investigation related to a beautiful, mysterious nightclub singer and a group of criminals who have kidnapped her child.",[]
2355,21 Grams,2003,Alejandro G. I?¨¢rritu,"Sean Penn, Benicio Del Toro, Naomi Watts, Danny Huston",0,0,0,1,0,0,0,0,0,0,0,0,0,0,0,0,0,0,0,1,1,0,"Paul Rivers, an ailing mathematician lovelessly married to an English ¨¦migr¨¦; Christina Peck, an upper-middle-class suburban housewife and mother of two girls; and Jack Jordan, a born-again ex-con, are brought together by a terrible accident that changes their lives.","['two', 'Jack Jordan', 'Paul Rivers', 'Christina Peck', 'English']"
2356,Traffic,2000,Steven Soderbergh,"Michael Douglas, Benicio Del Toro, Catherine Zeta-Jones, Jacob Vargas",0,0,0,1,0,0,0,0,0,0,0,0,0,0,0,0,0,0,0,1,1,0,"An exploration of the United States of America's war on drugs from multiple perspectives. For the new head of the Office of National Drug Control Policy, the war becomes personal when he discovers his well-educated daughter is abusing cocaine within their comfortable suburban home. In Mexico, a flawed, but noble policeman agrees to testify against a powerful general in league with a cartel, and in San Diego, a drug kingpin's sheltered trophy wife must learn her husband's ruthless business after he is arrested, endangering her luxurious lifestyle.","['America', 'the Office of National Drug Control Policy', 'San Diego', 'Mexico', 'the United States']"
2361,Delicatessen,1991,"Directors:Marc Caro, Jean-Pierre Jeunet","Marie-Laure Dougnac, Dominique Pinon, Pascal Benezech, Jean-Claude Dreyfus",0,0,0,0,0,0,0,0,0,0,0,0,0,0,1,0,0,0,0,1,0,0,"In a post-apocalyptic world, the residents of an apartment above the butcher shop receive an occasional delicacy of meat, something that is in low supply. A young man new in town falls in love with the butcher's daughter, which causes conflicts in her family, who need the young man for other business-related purposes.",[]
2365,Blood Simple,1984,"Directors:Joel Coen, Ethan Coen","John Getz, Frances McDormand, Dan Hedaya, M. Emmet Walsh",0,0,0,1,0,0,0,0,0,0,0,0,0,0,0,0,0,0,0,1,1,0,"The owner of a seedy small-town Texas bar discovers that one of his employees is having an affair with his wife. A chaotic chain of misunderstandings, lies and mischief ensues after he devises a plot to have them murdered.","['one', 'Texas']"
2368,West Side Story,1961,"Directors:Jerome Robbins, Robert Wise","Natalie Wood, George Chakiris, Richard Beymer, Russ Tamblyn",0,0,0,0,0,0,0,0,0,0,1,0,0,0,0,0,0,0,0,1,1,0,"In the slums of the upper West Side of Manhattan, New York, a gang of Polish-American teenagers called the Jets compete with a rival gang of recently immigrated Puerto Ricans, the Sharks, to ""own"" the neighborhood streets. Tensions are high between the gangs but two kids, one from each rival gang, fall in love leading to tragedy.","['Sharks', 'two', 'one', 'Manhattan', 'New York', 'West Side', 'Polish-American', 'Puerto Ricans', 'Jets']"
2370,The 39 Steps,1935,Alfred Hitchcock,"Robert Donat, Madeleine Carroll, Lucie Mannheim, Godfrey Tearle",0,0,0,1,0,0,0,1,0,0,0,0,0,0,0,0,0,0,0,1,0,0,"Richard Hanney has a rude awakening when a glamorous female spy falls into his bed -- with a knife in her back. Having a bit of trouble explaining it all to Scotland Yard, he heads for the hills of Scotland to try to clear his name by locating the spy ring known as ""The 39 Steps.""","['Scotland Yard', '""The 39 Steps', 'Richard Hanney', 'Scotland']"
2386,The Man Who Wasn't There,2001,Joel Coen,"Billy Bob Thornton, Frances McDormand, Michael Badalucco, James Gandolfini",0,0,0,0,0,0,0,0,0,0,0,0,0,0,0,0,0,0,0,1,1,0,"A tale of murder, crime and punishment set in the summer of 1949. Ed Crane, a barber in a small California town, is dissatisfied with his life, but his wife Doris' infidelity and a mysterious opportunity presents him with a chance to change it.","['Doris', 'California', 'the summer of 1949', 'Ed Crane']"
2390,A Simple Plan,1998,Sam Raimi,"Bill Paxton, Billy Bob Thornton, Bridget Fonda, Brent Briscoe",0,0,0,1,0,0,0,0,0,0,0,0,0,0,0,0,0,0,0,1,1,0,"Captivated by the lure of sudden wealth, the quiet rural lives of two brothers erupt into conflicts of greed, paranoia and distrust when over $4 million in cash is discovered at the remote site of a downed small airplane. Their simple plan to retain the money while avoiding detection opens a Pandora's box when the fear of getting caught triggers panicked behavior and leads to virulent consequences.","['two', 'Pandora', '$4 million']"
2393,Sleepers,1996,Barry Levinson,"Robert De Niro, Kevin Bacon, Brad Pitt, Jason Patric",0,0,0,1,0,0,0,0,0,0,0,0,0,0,0,0,0,0,0,1,1,0,Two gangsters seek revenge on the state jail worker who during their stay at a youth prison sexually abused them. A sensational court hearing takes place to charge him for the crimes.,['Two']
2394,Dead Man Walking,1995,Tim Robbins,"Susan Sarandon, Sean Penn, Robert Prosky, Raymond J. Barry",0,0,0,0,0,0,0,0,0,0,0,0,0,0,0,0,0,0,0,1,1,0,"A justice drama based on a true story about a man on death row who, in his last days, forms a strong relationship with a nun who teaches him forgiveness and gives him spirituality, as she accompanies him to his execution.",[]
2397,The Player,1992,Robert Altman,"Tim Robbins, Greta Scacchi, Fred Ward, Whoopi Goldberg",0,0,0,0,0,0,0,0,0,0,0,0,0,0,1,0,0,0,0,1,1,0,A Hollywood studio executive is being sent death threats by a writer whose script he rejected - but which one?,['Hollywood']
2401,A Fish Called Wanda,1988,"Directors:Charles Crichton, John Cleese","John Cleese, Jamie Lee Curtis, Kevin Kline, Michael Palin",0,0,0,0,0,0,0,0,0,0,0,0,0,0,1,0,0,0,0,1,0,0,"A diamond advocate is attempting to steal a collection of diamonds, yet troubles arise when he realizes that he is not the only one after the diamonds.",[]
2421,A Time to Kill,1996,Joel Schumacher,"Matthew McConaughey, Sandra Bullock, Samuel L. Jackson, Kevin Spacey",0,0,0,1,0,0,0,0,0,0,0,0,0,0,0,0,0,0,0,1,1,0,"A young lawyer defends a black man accused of murdering two white men who raped his 10-year-old daughter, sparking a rebirth of the KKK.","['two', 'KKK', '10-year-old']"
2452,Bound,1996,"Directors:Lana Wachowski, Lilly Wachowski","Jennifer Tilly, Gina Gershon, Joe Pantoliano, John P. Ryan",0,0,0,1,0,0,0,0,0,0,0,0,0,0,0,0,0,0,0,1,0,0,"Corky, a tough female ex-convict working on an apartment renovation in a Chicago building, meets a couple living next door, Caesar, a paranoid mobster, and Violet, his seductive girlfriend, who is immediately attracted to her.","['Violet', 'Chicago', 'Caesar', 'Corky']"
2453,Shallow Grave,1994,Danny Boyle,"Kerry Fox, Christopher Eccleston, Ewan McGregor, Ken Stott",0,0,0,1,0,0,0,0,0,0,0,0,0,0,0,0,0,0,0,1,0,0,"When accountant David, doctor Juliet and journalist Alex are searching for a fourth roommate for their trendy flat, they settle on the aloof Hugo. However, they soon find Hugo dead of a drug overdose, beside a large sum of cash. After some deliberation, the three others decide to keep the money and to dismember and bury Hugo's body. Soon, each roommate starts thinking about keeping all the money by scamming the others.","['fourth', 'Hugo', 'three', 'David', 'Juliet', 'Alex']"
2457,Raising Arizona,1987,"Directors:Joel Coen, Ethan Coen","Nicolas Cage, Holly Hunter, Trey Wilson, John Goodman",0,0,0,0,0,0,0,0,0,0,0,0,0,0,1,0,0,0,0,1,0,0,"When a childless couple of an ex-con and an ex-cop decide to help themselves to one of another family's quintuplets, their lives become more complicated than they anticipated.",['one']
2480,Go,1999,Doug Liman,"Sarah Polley, Jay Mohr, Scott Wolf, Taye Diggs",0,0,0,0,0,0,0,0,0,0,0,0,0,0,1,0,0,0,0,1,0,0,"Grocery store clerk Simon occasionally sells drugs from his cash register at work, so when soap opera actors Adam and Zack come looking for Ecstasy on a quiet Christmas Eve, they are surprised to find Ronna covering his shift. Desperate for money, Ronna decides to become an impromptu drug dealer, unaware that Adam and Zack are secretly working for obsessed narcotics officer Burke.","['a quiet Christmas Eve', 'Zack', 'Adam', 'Burke', 'Simon', 'Ronna']"
2485,Heathers,1988,Michael Lehmann,"Winona Ryder, Christian Slater, Shannen Doherty, Lisanne Falk",0,0,0,0,0,0,0,0,0,0,0,0,0,0,1,0,0,0,0,1,0,0,,
2518,Strange Days,1995,Kathryn Bigelow,"Ralph Fiennes, Angela Bassett, Juliette Lewis, Tom Sizemore",0,0,0,0,0,0,0,0,0,0,0,0,0,0,0,0,0,1,0,1,1,0,"In the last days of 1999, ex-cop turned street hustler Lenny Nero receives a disc which contains the memories of the murder of a prostitute. With the help of bodyguard Mace, he starts to investigate and is pulled deeper and deeper in a whirl of murder, blackmail and intrigue. Can the pair live to see the new millennium?","['the last days of 1999', 'Lenny Nero', 'Mace', 'the new millennium']"
2545,Out of Sight,1998,Steven Soderbergh,"George Clooney, Jennifer Lopez, Ving Rhames, Steve Zahn",0,0,0,0,0,0,0,0,0,0,0,0,0,0,1,0,0,0,0,1,1,0,"Meet Jack Foley, a smooth criminal who bends the law and is determined to make one last heist. Karen Sisco is a federal marshal who chooses all the right moves ¡­ and all the wrong guys. Now they're willing to risk it all to find out if there's more between them than just the law.","['Jack Foley', 'one', 'Karen Sisco']"
2556,Trust,2010,David Schwimmer,"Clive Owen, Catherine Keener, Liana Liberato, Jason Clarke",0,0,0,1,0,0,0,0,0,0,0,0,0,0,0,0,0,0,0,1,1,0,"A suburban family is torn apart when fourteen-year-old Annie meets her first boyfriend online. After months of communicating via online chat and phone, Annie discovers her friend is not who he originally claimed to be. Shocked into disbelief, her parents are shattered by their daughter's actions and struggle to support her as she comes to terms with what has happened to her once innocent life.","['Annie', 'months', 'fourteen-year-old', 'first']"
2698,Sleuth,2007,Kenneth Branagh,"Michael Caine, Jude Law, Harold Pinter, Kenneth Branagh",0,0,0,0,0,0,0,1,0,0,0,0,0,0,0,0,0,0,0,1,1,0,"On his sprawling country estate, an aging writer matches wits with the struggling actor who has stolen his wife's heart.",[]
2724,The Producers,2005,Susan Stroman,"Nathan Lane, Matthew Broderick, Uma Thurman, Will Ferrell",0,0,0,0,0,0,0,0,0,0,1,0,0,0,1,0,0,0,0,1,0,0,"After putting together another Broadway flop, down-on-his-luck producer Max Bialystock teams up with timid accountant Leo Bloom in a get-rich-quick scheme to put on the world's worst show.","['Leo Bloom', 'Broadway', 'Max Bialystock']"
2875,The Great Escape,1963,John Sturges,"Steve McQueen, James Garner, Richard Attenborough, Charles Bronson",0,0,0,0,1,0,0,0,0,0,0,0,0,0,0,0,1,0,0,0,1,0,"The Nazis, exasperated at the number of escapes from their prison camps by a relatively small number of Allied prisoners, relocate them to a high-security 'escape-proof' camp to sit out the remainder of the war. Undaunted, the prisoners plan one of the most ambitious escape attempts of World War II. Based on a true story.","['Nazis', 'World War II', 'Allied', 'one']"
2879,JFK,1991,Oliver Stone,"Kevin Costner, Gary Oldman, Jack Lemmon, Walter Matthau",0,0,0,1,0,0,0,0,0,0,0,0,0,0,0,0,1,0,0,0,1,0,Follows the investigation into the assassination of President John F. Kennedy led by New Orleans district attorney Jim Garrison.,"['John F. Kennedy', 'Jim Garrison', 'New Orleans']"
2883,All the President's Men,1976,Alan J. Pakula,"Dustin Hoffman, Robert Redford, Jack Warden, Martin Balsam",0,0,0,1,0,0,0,0,0,0,0,0,0,0,0,0,1,0,0,0,1,0,"During the 1972 elections, two reporters' investigation sheds light on the controversial Watergate scandal that compels President Nixon to resign from his post.","['Nixon', 'two', '1972', 'Watergate']"
2884,The Ten Commandments,1956,Cecil B. DeMille,"Charlton Heston, Yul Brynner, Anne Baxter, Edward G. Robinson",0,0,0,0,1,0,0,0,0,0,0,0,0,0,0,0,0,0,0,0,1,1,"Escaping death, a Hebrew infant is raised in a royal household to become a prince. Upon discovery of his true heritage, Moses embarks on a personal quest to reclaim his destiny as the leader and liberator of the Hebrew people.","['Moses', 'Hebrew']"
2886,The Man Who Would Be King,1975,John Huston,"Sean Connery, Michael Caine, Christopher Plummer, Saeed Jaffrey",1,0,0,0,1,0,0,0,0,0,0,0,0,0,0,0,1,0,0,0,0,0,"A robust adventure about two British adventurers who take over primitive Kafiristan as ""godlike"" rulers, meeting a tragic end through their desire for a native girl. Based on a short story by Rudyard Kipling.","['two', 'British', 'Rudyard Kipling', 'Kafiristan']"
2889,Apollo 13,1995,Ron Howard,"Tom Hanks, Bill Paxton, Kevin Bacon, Gary Sinise",0,0,0,0,1,0,0,0,0,0,0,0,0,0,0,0,1,0,0,0,1,0,"The true story of technical troubles that scuttle the Apollo 13 lunar mission in 1970, risking the lives of astronaut Jim Lovell and his crew, with the failed journey turning into a thrilling saga of heroism. Drifting more than 200,000 miles from Earth, the astronauts work furiously with the ground crew to avert tragedy.","['more than 200,000 miles', 'Earth', 'Apollo 13', '1970', 'Jim Lovell']"
2903,Gallipoli,1981,Peter Weir,"Mel Gibson, Mark Lee, Bill Kerr, Harold Hopkins",0,0,0,0,1,0,0,0,0,0,0,0,0,0,0,0,1,0,0,0,1,0,"As World War I rages, brave and youthful Australians Archy and Frank¡ªboth agile runners¡ªbecome friends and enlist in the Australian and New Zealand Army Corps together. They later find themselves part of the Dardanelles Campaign on the Gallipoli peninsula, a brutal eight-month conflict which pit the British and their allies against the Ottoman Empire and left over 500,000 men dead.","['Australian', 'British', 'the Dardanelles Campaign', 'eight-month', 'World War I', 'Australians', 'New Zealand Army Corps', 'Archy', 'the Gallipoli peninsula', 'Frank', '500,000', 'the Ottoman Empire']"
2919,Shakespeare in Love,1998,John Madden,"Gwyneth Paltrow, Joseph Fiennes, Geoffrey Rush, Tom Wilkinson",0,0,0,0,0,0,0,0,0,0,0,0,0,0,1,0,1,0,0,0,1,0,"Young Shakespeare is forced to stage his latest comedy, ""Romeo and Ethel, the Pirate's Daughter,"" before it's even written. When a lovely noblewoman auditions for a role, they fall into forbidden love -- and his play finds a new life (and title). As their relationship progresses, Shakespeare's comedy soon transforms into tragedy.","[""Romeo and Ethel, the Pirate's Daughter"", 'Shakespeare']"
2937,The Prestige,2006,Christopher Nolan,"Christian Bale, Hugh Jackman, Scarlett Johansson, Michael Caine",0,0,0,0,0,0,0,1,0,0,0,0,0,0,0,0,0,1,0,0,1,0,"A mysterious story of two magicians whose intense rivalry leads them on a life-long battle for supremacy -- full of obsession, deceit and jealousy with dangerous and deadly consequences.",['two']
2938,Apocalypse Now,1979,Francis Ford Coppola,"Martin Sheen, Marlon Brando, Robert Duvall, Frederic Forrest",1,0,0,0,0,0,0,1,0,0,0,0,0,0,0,0,0,0,0,0,1,0,"At the height of the Vietnam war, Captain Benjamin Willard is sent on a dangerous mission that, officially, ""does not exist, nor will it ever exist."" His goal is to locate - and eliminate - a mysterious Green Beret Colonel named Walter Kurtz, who has been leading his personal army on illegal guerrilla missions into enemy territory.","['Benjamin Willard', 'the Vietnam war', 'Walter Kurtz']"
2939,Psycho,1960,Alfred Hitchcock,"Anthony Perkins, Janet Leigh, Vera Miles, John Gavin",0,0,0,1,0,0,0,1,1,0,0,0,0,0,0,0,0,0,0,0,0,0,"When larcenous real estate clerk Marion Crane goes on the lam with a wad of cash and hopes of starting a new life, she ends up at the notorious Bates Motel, where manager Norman Bates cares for his housebound mother.","['Marion Crane', 'Norman Bates', 'Bates Motel']"
2940,Rear Window,1954,Alfred Hitchcock,"James Stewart, Grace Kelly, Wendell Corey, Thelma Ritter",0,0,0,1,0,0,0,1,0,0,0,0,0,0,0,0,0,0,0,0,0,0,A wheelchair-bound photographer spies on his neighbors from his apartment window and becomes convinced one of them has committed murder.,['one']
2941,The Lives of Others,2006,Florian Henckel von Donnersmarck,"Ulrich M¨¹he, Martina Gedeck, Sebastian Koch, Ulrich Tukur",0,0,0,1,0,0,0,1,0,0,0,0,0,0,0,0,0,0,0,0,1,0,A tragic love story set in East Berlin with the backdrop of an undercover Stasi controlled culture. Stasi captain Wieler is ordered to follow author Dreyman and plunges deeper and deeper into his life until he reaches the threshold of doubting the system.,"['Stasi', 'Dreyman', 'East Berlin', 'Wieler']"
2942,Memento,2000,Christopher Nolan,"Guy Pearce, Carrie-Anne Moss, Joe Pantoliano, Mark Boone Junior",0,0,0,1,0,0,0,1,0,0,0,0,0,0,0,0,0,0,0,0,0,0,"Leonard Shelby is tracking down the man who raped and murdered his wife. The difficulty of locating his wife's killer, however, is compounded by the fact that he suffers from a rare, untreatable form of short-term memory loss. Although he can recall details of life before his accident, Leonard cannot remember what happened fifteen minutes ago, where he's going, or why.","['Leonard', 'fifteen minutes ago', 'Leonard Shelby']"
2943,Incendies,2010,Denis Villeneuve,"Lubna Azabal, M¨¦lissa D¨¦sormeaux-Poulin, Maxim Gaudette, Mustafa Kamel",0,0,0,0,0,0,0,1,0,0,0,0,0,0,0,0,0,0,0,0,1,0,"A mother's last wishes send twins Jeanne and Simon on a journey to Middle East in search of their tangled roots. Adapted from Wajdi Mouawad's acclaimed play, Incendies tells the powerful and moving tale of two young adults' voyage to the core of deep-rooted hatred, never-ending wars and enduring love.","['Middle East', 'two', 'Jeanne', 'Incendies', 'Simon', ""Wajdi Mouawad's""]"
2944,Vertigo,1958,Alfred Hitchcock,"James Stewart, Kim Novak, Barbara Bel Geddes, Tom Helmore",0,0,0,1,0,1,0,1,0,0,0,0,0,0,0,0,0,0,0,0,0,0,"A retired San Francisco detective suffering from acrophobia investigates the strange activities of an old friend's wife, all the while becoming dangerously obsessed with her.",['San Francisco']
2945,Citizen Kane,1941,Orson Welles,"Orson Welles, Joseph Cotten, Dorothy Comingore, Agnes Moorehead",0,0,0,0,0,0,0,1,0,0,0,0,0,0,0,0,0,0,0,0,1,0,"Newspaper magnate, Charles Foster Kane is taken from his mother as a boy and made the ward of a rich industrialist. As a result, every well-meaning, tyrannical or self-destructive move he makes for the rest of his life appears in some way to be a reaction to that deeply wounding event.",['Charles Foster Kane']
